"Kulturní aktivity","2016","FHT/PHT/030343/2016"," Středočeští výtvarníci 2016 v galerii ""V Potoční"" v Příbrami","Výstava je zařazena do akcí k 800 letům vzniku města Příbram. Jedná se o výběr obrazů, kreseb, fotografií a plastik od výtvarníků, kteří tvoří v nejrůznějších výtvarných oborech. Všechny ale spojuje sounáležitost se středočeským krajem a přispívají profesionální svojí činností k estetické kultivaci regionu. Patří mezi ně na příklad: Ivan Bukovský, Anna Vančátová, Zdena Fidlerová,Miloslav Moucha,Václav Zoubek, Jitka Válová, Jindřich Zeithamml, Silva Šindelářová, Viktor Žabinský, Zbyněk Novotný, Eva Roučka, Jaromír Másler, Marcela Adamcová, Milada Mojsejová, Anatolij Ključinskij, Marek Hájek, Hana Pulkrábková, Karel Pauzr, Pankraz Zhanna a další.Během výstavy proběhnou dvě komentované prohlídky. V rámci spolupráce se ZUŠ Antonína Dvořáka v Příbrami s výtvarnou třídou ak.mal. Zdeny Fiedlerové proběhnou v galerii mezi obrazy vyučovací hodiny malování, aby si žáci mohli porovnat tvorbu různých autorů a různých uměleckých směrů. Galerie připravovanou výstavou si dává za cíl oslovit širokou veřejnost a seznámit je z tvorbou výtvarných umělců ze středočeského kraje.Přínos projektu spočívá i v tom, že se budou pořádat přednášky odborníků na výtvarné umění například od pana Stanislava Sloupa. Galerie chce oslovit mládež ze škol, milovníky umění, odbornou veřejnost, sběratele umění i ostatní zájemce o výtvarné umění. Chce rozšířit kulturní nabídku při oslavách 800 let vzniku města Příbram.","neschváleno RK","35000","28000","","80","","",""
"Podpora činnosti","2016","FHT/PHT/030445/2016","N Klub Nymburk","Projekt je zaměřen na podporu činnosti Nízkoprahového zařízení pro děti a mládež v Nymburce, které vzniklo v druhé polovině roku 2013 jako jedna z priorit Střednědobého plánu rozvoje sociálních služeb města Nymburk. , Služba je provozována ambulantně čtyři dny v týdnu, a to v pondělí, úterý, středu a čtvrtek v odpoledních hodinách., Personální zajištění služby NZDM Nymburk je v současné době následující: Vedoucí NZDM (pracovní smlouva - 0,25 úvazku), Sociální a kontaktní pracovníci (2 x pracovní smlouva – celkem 1,00 úvazku). Přímá práce s klienty je poskytována v rozsahu cca 80 hodin/měsíc. Další činnost je realizována mimo otevírací dobu klubu. Jedná se zejména o spolupráci s dalšími institucemi, vedení klientské dokumentace, přípravu programu, pravidelné porady a supervize, zpracování standardů sociální služby apod.    , NZDM je umístěno v samostatném objektu v přímé blízkosti panelové zástavby a základní školy. Tato lokalita se vzhledem k potřebám komunity jeví jako ideální. Zařízení je v současné době nejčastěji využíváno cílovou skupinou dětí a mládeže ve věku 12 – 16 let. Cílová skupina do klubu míří z celého města vzhledem k jeho dobrému umístění. , Charakteristika klientů služby je následující: věk mezi 13 – 16, bez trvalého zájmu o strukturované a pravidelné aktivity, běžné trávení volného času na ulici, ve škole se vyskytují problémy především s dopady nevhodného chování, školní neúspěšnost, různé formy rizikového chování, nestabilní či nepříznivé rodinné zázemí., , Popis služby, Posláním NZDM Nymburk je poskytovat ambulantní služby dětem a mladým lidem ve věku od 6 do 22 let ohroženým rizikovým chováním. Cílem služby je zlepšit kvalitu jejich života předcházením nebo snížením sociálních a zdravotních rizik souvisejících se způsobem jejich života, umožnit jim lépe se orientovat v jejich sociálním prostředí a vytvářet podmínky k řešení jejich nepříznivé sociální situace. Služba muže být poskytována osobám anonymně. Mezi nabízené aktivity patří:, - zážitkové programy s tématy rizikového chování, - sociální poradenství, - krizová intervence, - sociálně terapeutické služby, - doučování a příprava do školy, - doprovod do dalších zařízení a institucí, - nestrukturované volnočasové aktivity, - výtvarné dílny, - filmové kluby, , Všechny nabízené aktivity jsou poskytovány bezplatně a anonymně., Mezi nejčastěji využívané služby patří především doučování a příprava do školy, výtvarné a rukodělné dílny a socioterapeutické služby. Nejčastěji řešenými tématy jsou vztahy s vrstevníky, vztahy v rodině a partnerské problémy. , , Co se týká financování služby, po ukončení podpory z individuálního projektu (2014) řešíme každoročně přežití služby. Optimální rozpočet zařízení je 1,2mil Kč, disponujeme pověřením od SK na 2,4mil Kč, avšak současné zdroje na zajištění služby činí pouze 745.200 (525.200 MPSV-SK + 220.000 Město Nymburk). Z tohoto důvodu také žádáme o mimořádnou dotaci, aby bylo možné službu zachovat alespoň v minimálním smysluplném rozsahu pro rok 2016.","neschváleno RK","945200","200000","","21.15954295","","",""
"Pořízení vybavení pro sociální, kulturní, sportovní a vzdělávací aktivity","2016","FHT/PHT/030359/2016","Husqvarna TC 142, zahradní traktor se sběrným košem ","Zakoupení zahradního traktoru na úpravu hrací plochy - hřiště. Oslovil jsem pět dodavatelů s poptávkou a zadanými parametry na uvedenou techniku. Na základě zaslaných cenových nabídek byl na výborové schůzi vybrán výše uvedený zahradní traktor, který je nyní ve slevě. Důležité pro nás je také to, že firma Husqvarna má v našem městě zastoupení, záruční servis, levné opravy. Naše FK má dvě mužstva dospělých a šest mužstev v mládežnických kategoriích od minipřípravky po dorost. Stávající zahradní traktor je starý čtrnáct let a je již pro úpravu hrací plochy nepoužitelný.","neschváleno RK","80990","64792","","80","","",""
"Vzdělávání","2016","FHT/PHT/030361/2016","Bezpečnostní forum Středočeského kraje","Série konferencí, která je organizována v jednotlivých krajích, probírá jednotlivé prvky kritické infrastruktury pro případy krize. Konfrence je určena zástupcům státní správy a samosprávy, centrálních úřadů a dalších institucí, mající gesci bezpečnosti na starost a zástupcům společností, pro něž má tato problematika také význam.","neschváleno RK","180000","100000","","55.55555556","","",""
"Sportovní aktivity","2016","FHT/PHT/030362/2016","Nučická stezka - 39. ročník","Popis projektu: Nučická stezka je známým dlouholetým veřejným závodem mimo dráhu na trati 6,1 km pro muže, dorostence a ženy – vytrvalkyně. Trať 1,9 km pro ženy a dorostenky a na trati 1,0 km pro mladší a starší žáky a žákyně. Závodu se zúčastňují nejen amatérští běžci z blízkého i vzdáleného okolí, ale také registrovaní atleti z různých oddílů v republice ( Atletika Chuchle, Loko Beroun, AK Kroměříž, USK Universita Brno, Spartak Praha, USK Praha, AC Trutnov,…). Závodu se tradičně účastní děti ze základních škol z Nučic a blízkého okolí (Vysoký Újezd, Tachlovice, Jinočany, Rudná...) Závod je určen pro všechny generace. Pro nejmladší a mladší závodníky je každým rokem připraven bohatý doprovodný program např.: - skákací hrad - soutěže a hry - malování na obličej - lukostřelba - ukázky hasičského zásahu jednotky SDH NUČICE - vystoupení mažoretek atd. Všechny zúčastněné děti obdrží od pořadatelů věcné ceny nezávisle na umístění v závodu. Dospělí účastníci jsou dle umístění odměněni finančními cenami, které jsou taktéž doplněny věcnými dary. Za účast v závodu obdrží všichni účastníci pamětní list a tradiční nučický perníček. Nučická stezka má velmi dlouholetou tradici (39 let) a každým rokem přibývá nových závodníků, v roce 2015 se závodu zúčastnilo celkem 277 závodníků. Trať hlavního závodu je vedena po asfaltových komunikacích v Nučicích a sousedních obcích Dobříči a Tachlovicích. Trať závodu žen a žákovských kategoriích je vedena pouze ulicemi obce Nučice. Pro závod není provedena uzavírka komunikací, po kterých je vedena trasa závodu, je však zajištěn doprovod závodníků na trase závodu. Místo registrace závodníků, startu a cíle závodu, šatny, sociální zařízení a prostory pro pořadatelskou službu, rozhodčí a zdravotní dozor jsou umístěny v areálu SK Nučice. Cíle a přínosy projektu: - zlepšení nabídky volnočasových aktivit - podpora sportování nejen mládeže - podpora soudržnosti obyvatel obce a regionu - udržení dlouholeté tradice závodu, která trvá již 39 let - podpora zdravého životního stylu obyvatel regionu - zlepšení kulturního a společenského života v regionu Cílové skupiny: a) mladší žákyně do 10 let b) mladší žáci c) starší žákyně do 15 let d) starší žáci e) ženy f) muži do 30 let g) muži do 40 let h) muži do 50 let i) muži nad 50 let j) ženy vytrvalkyně k) děti předškolního věku Výchozí situace: Závodu v běhu se mohou zúčastnit všichni zájemci, kteří se registrují na registračním místě, a to nejpozději 30 minut před startem příslušné kategorie. Registrace je nově možná i na webových stránkách obce Nučice. Závodníci, pořadatelé a rozhodčí jsou pojištění proti úrazu a je jim bezplatně poskytován pitný režim v době konání závodu a lehké občerstvení po jeho skončení. Zdůvodnění potřeby realizace projektu: celkové zlepšení prestiže Středočeského kraje, zvětšení povědomí o podporovaných akcí Středočeského kraje podpořením publicity projektu (zveřejnění podpory v místním, regionálním tisku, diplomy, pozvánky, internet) Realizace závodu: zahájení, start a cíl, vyhlášení výsledků, předání cen Kategorie závodu : a) mladší žákyně do 10 let délka tratě 300 m v areálu TJ Sokol Nučice b) mladší žáci délka tratě 300 m v areálu TJ Sokol Nučice c) starší žákyně do 15 let délka tratě 1,0 km d) starší žáci délka tratě 1,0 km e) ženy délka tratě 1,9 km f) muži do 30 let délka tratě 6,1 km g) muži do 40 let délka tratě 6,1 km h) muži do 50 let délka tratě 6,1 km i) muži nad 50 let délka tratě 6,1 km j) ženy vytrvalkyně délka tratě 6,1 km k) děti předškolního věku - závodu v areálu hřiště. Popis způsobu realizace projektu: Příprava a organizace závodu, nákup diplomů, občerstvení a cen, administrace celého projektu - kontaktování rozhodčích, doprovodných vozidel, lékaře, propagace závodu, zajištění doprovodného programu Možná rizika realizace projektu: - nepřízeň počasí - malá propagace projektu - nezájem závodníků","neschváleno RK","120000","50000","","41.66666667","","",""
"Sportovní aktivity","2016","FHT/PHT/030364/2016","Cestovní výdaje pro tenistku Radku Bužkovou","Cestovní grant, Radka Bužková, narozená 2. 3. 2000 je tenistka s aktuálním umístěním na světovém juniorském žebříčku International Tennis Federation na 366. místě. V současné době hraje v klubu I.ČLTK (Český Lawn-Tennis Klub) Praha. Účastní se mezinárodních soutěží, se kterými jsou spojeny vysoké náklady. V rámci podpory činnosti bychom chtěli požádat o cestovní grant pro účasti na mezinárodních soutěžích kategorie International Tennis Federation. ITF je mezinárodní tenisová organizace, která řídí dění ve světovém tenise a pořádá 3 základní týmové soutěže založené na národním charakteru. , V roce 2005 až 2008 Radka Bužková zvítězila na několika turnajích minitenisu po celé České republice. V následujících letech byla součástí vítězného týmu 8 nejlepších hráčů ze seriálu turnajů na prestižním turnaji Masters a stala se vítězkou na 5 turnajích kategorie B mladších žákyň. , V letech 2011-2012 se stala vítězkou na prestižním turnaji Tennis Europe U12 v Kufsteinu a na turnaji TE U12 v České republice. Poté se umístila na 3. místě v halovém Mistrovství České republiky v kategorii mladších žákyň a po sezoně na 4. místě celostátního žebříčku mladších žákyň., V následujících letech získala vítězství na turnajích B starších žákyň v Rakovníku a ve čtyřhře na turnaji TE U14 ve Španělsku. Roku 2013 zvítězila na turnaji Tennis Europe U12 v kategorii 2 v Izraeli a na turnaji Tennis Europe U14 v kategorii 2 v Oberpullendorfu. Radka se účastnila i Mistrovství Evropy U14 a letního i halového Místrovství České republiky. Na konci sezony roku 2014 získala 30. místo žebříčku Tennis Europe a stala se členkou střediska vrcholového tenisu. , Roku 2015/2016 se stala halovou mistryní České republiky dorostenek ve dvouhře i čtyřhře. V jednotlivých letech lze vidět značný pokrok v umístěních na celostátních soutěžích. Získaný grant by nám pomohl v dalším rozvoji a reprezentaci našich sportovců ve světě. , Se zápasy jsou spojeny každoroční cestovní výdaje ve výši zhruba 150.000,-. Rádi bychom podpořili její reprezentaci a požádali o příspěvek na její cestovní výdaje. , ","neschváleno RK","149000","130000","","87.24832215","","",""
"Sportovní aktivity","2016","FHT/PHT/030365/2016","ELEVEN KARLŠTEJNSKÁ DEVÍTKA","Vážený pane hejtmane, Vážení zastupitelé Středočeského kraje,, jako náčelník pobočného spolku T.K. Záskalák Liteň se na Vás obracím s žádostí o poskytnutí dotace na 4. ročník běhu pro širokou veřejnost ELEVEN KARLŠTEJNSKÁ DEVÍTKA., , Rádi bychom navázali na tradici již vzniklých běhů, které prořádalo SVČ Domeček Hořovice, které z kapacitních důvodů již tento běh nemůže realizovat., Jedná se v roce 2016 o již 4. ročník tohoto běhu. Závod se bude konat v areálu kempu v Karlštejně pro děti, dospělí poběží Karlštejnem kolem hradu Karlštejna a dále karlštejnskými lesy a vinicí zpět do kempu. Kategorie závodů jsou od dětí, které už samo chodí a horní hranice není určená. Bude se startovat v 7 dětských kategoriích, které jsou rozděleny na chlapce a dívky, dále dorostenci - dívky a chlapci a 9 kategorií pro dospělé - 4 kategorie pro ženy a 5 kategorií pro muže. Dále je do tohoto běhu zařazen závod pro zdraví a kondici, kde je vítěz určen losem. Závod se řídí podle pravidel lehké atletiky. Historie běhu I. ročník 174 - startujících, II. ročník 202 startujících a III. ročník 242 startujících., , Předem děkujeme za vyřízení naší žádosti., , V Litni, Jana Krtková","neschváleno RK","110000","82500","","75","","",""
"Kulturní aktivity","2016","FHT/PHT/030366/2016","Čtyři ženy Karla IV. - turné sboru Vox Nymburgensis po Středočeském kraji s unikátním písňovým cyklem ke karolinskému výročí","uvedení unikátního vokálně - instrumentálního cyklu písní k 700. výročí Karla IV.: Otmar Mácha  Uxores Caroli ( Ženy Karlovy). Skladbu pro sbor, cembalo, flétny, loutnu a bicí nástroje uvede sbor v Nymburce, Praskolesích, Říčanech, případně v dalších místech Středočeského kraje. Málo známá a přitom hudebně velmi zajímavá kompozice měla premiéru v r. 1978, od té doby se však - pravděpodobně pro svou obtížnost - představuje jen velmi zřídka. Sbor chce využít letošního karolinského výročí k jejímu znovuuvedení. Koncerty budou profesionálně moderovány. Náklady: materiálové ( notový materiál, přeprava nástrojů, projektor), na služby ( sólisté), osobní (  moderace)., ","neschváleno RK","94000","70000","","74.46808511","","",""
"Podpora činnosti","2016","FHT/PHT/030367/2016","Podpora a rozvoj mládežnického hokeje v Příbrami","Projekt si klade za cíl zvýšit povědomí o sportovní činnosti, a zejména hokeji, u dětí na školách v příbramském okrese a realizovat novou sportovní koncepci týmů včetně nové sportovní výbavy pro nejmenší děti a nové trenérské struktury těchto nižších ročníků. Touto aktivitou se projekt snaží přimět děti věnovat volný čas sportovní aktivitě a rozvíjet jejich psychickou a fyzickou odolnost. Zvýšit informovanost o hokejové aktivitě na příbramském okrese, umožnit nejmenším dětem zapůjčit si výzbroj (tzn. snížit finanční náročnost rodičům) a dále zvýšit sportovní úroveň hokejových týmů díky realizaci nové sportovní koncepce.","neschváleno RK","250000","100000","","40","","",""
"Kulturní aktivity","2016","FHT/PHT/030369/2016","Oblastní výstava psů všech plemen mimo NO","III. ročník Oblastní výstavy psů všech plemen mino Německých ovčáků je společenská událost pořádaná se záměrem podpořit společenský život občanů, zapojení se mládeže do volnočasových aktivit, podpořit hlavně mládež, ale i dospělé v oblasti společenského chování a vystupování, upevňovat vztah ke zvířatům a životnímu prostředí. Hostům se smažíme připravit výborně zorganizovanou akci v překrásném prostředí města Příbram, která by měla posloužit ke spokojenosti všech. Prioritou a myšlenkou ale je hlavně motivovat a zapojit mládež, která se dnes bohužel do společenských a sportovních aktivit zapojuje čím dál méně. Zájmem a záměrem našeho kynologického klubu je, díky pořádání společenských akcí se psy a správnou motivací zaujmout mladé lidi, aby se svými pejsky vstoupili jako členové do našeho klubu a naší myšlenku dále podporovali a v této činnosti a osvětě pokračovali. Na výstavě očekáváme cca 150 účastníků, takže příprava je velmi náročná jednak na počet organizátorů tak i finančně nákladná. Dále budeme určitě velmi důkladně prezentovat výsledek této akce (formou jednak písemnou a zároveň fotodokumentací) pro další zájem v příštích letech. Peníze z dotace by velmi pomohly k provádění této výstavy, zajištění dobrého průběhu akce a tím by přispěly k podpoře zapojení se mládeže do společenského života v oblasti zejména kynologie.","neschváleno RK","36000","34200","","95","","",""
"Kulturní aktivity","2016","FHT/PHT/030370/2016","Vydání publikace Živá kronika Svídnice","Ve vsi Svídnice probíhá projekt Živá kronika Svídnice, který je podpořen Nadací VIA. Cílem projektu je podpořit rozvoj vztahů mezi starousedlíky, novousedlíky a chataři, najít příležitost k seznamování a utužování vazeb, podpořit vzájemnou pomoc. Chceme v lidech probudit zájem zaznamenávat dění vesnice kolem sebe, podílet se na rozvoji komunikace mezi lidmi a připojit se k oživování místních tradic. K dosažení cíle vznikl společný projekt vytvoření „Živé kroniky Svídnice“, tzn. po celý rok sbírat audiovizuální stopy (film, fotografie, obrázky, písemné záznamy, výrobky) o životě ve Svídnici s důrazem na oslavy 680. výročí od jejího vzniku. Živou kroniku Svídnice můžete sledovat na Facebooku, Youtube, na oslavách 680 let obce 11.6.2016 a festivalu Divadelní buzení aneb Živá kronika Svídnice. V rámci dotace od Nadace VIA jsme obdrželi 75000 Kč na realizaci celého projektu, avšak na vydání tištěné publikace Živé kroniky pouze 5012 Kč, protože Nadace VIA má požadavek hledat finance na publikaci i u dalších donátorů. Celkové náklady na publikaci jsou cca 40000 Kč, zatím máme 5012 Kč od Nadace VIA, 10000 Kč od obce Dymokury a 2825 Kč od soukromých dárců. V současnosti probíhá sbírka mezi veřejností spjatou s místem., ","neschváleno RK","40000","10000","","25","","",""
"Sportovní aktivity","2016","FHT/PHT/030382/2016","Újezdský pohár 2016","V roce 2004 byl uspořádán I. ročník fotbalového turnaje obcí tzv. „Újezdský pohár“, který každoročně pořádá jedna ze spřátelených obcí a to: Újezd u Uničova, Horní Újezd (Přerov), Velký Újezd (Olomouc), Horní Újezd (Třebíč), Horní Újezd (Litomyšl) a v letošním roce naše obec Pletený Újezd (Kladno). Jedná se o tradici a v letošním roce se koná již XIII. ročník. Součástí této sportovní akce je i setkání představitelů jednotlivých obcí za účelem výměny zkušeností např. s čerpáním státních i evropských dotací, činností spolků apod. Většinu činností spojených s organizací této akce se snažíme zajistit svépomocí, za podpory jiných spolků působících v obci či za podpory samotné obce. Vzhledem k tomu, že naše tělovýchovná jednota potažmo fotbalový oddíl disponuje ročním rozpočtem, který zcela pokryje náklady na zajištění chodu tělovýchovné jednoty a tato výjimečná akce je pro nás finančně náročná, žádáme tímto o poskytnutí dotace na náklady spojené s propagací akce, nájmu mobilních toalet, odměny rozhodčích, hudební produkcí a pořízení cen dle umístění jednotlivých týmů (míče, poháry, dárkové koše apod.).","neschváleno RK","22600","20000","","88.49557522","","",""
