"Podpora činnosti","2016","FHT/PHT/030436/2016","Rozhýbeme příbramské seniory","ZÁKLADNÍ IDEA A POPIS PROJEKTU:, , Cílem projektu je zapojení příbramských seniorů do pravidelných pohybových aktivit, které pro ně vytváříme. Preventivně tak pozitivně působíme na jejich zdravotní stav a kvalitu života. , VÝCHOZÍ STAV - SITUACE KTEROU CHCEME ŘEŠIT:, , Senioři se často setkávají s doporučením “musíte cvičit”, ovšem mimo časově omezenou rehabilitaci předepsanou lékařem se v Příbrami nenabízí žádný ucelený systém pohybových aktivit, věnovaných právě seniorům, jež zohledňuje věk a zdravotní stav této cílové skupiny. Proto jsme v roce 2012 začali cvičení pro seniory pořádat. Z původního počtu účastníků (40 osob) v roce prvním, jsme v roce 2015 cvičili již s téměř 150 cvičenci. Ze zpětné vazby máme od seniorů informace, že oceňují nejen možnost a kvalitu cvičení, ale také jeho cenovou dostupnost. , Vytvořili jsme fungující neziskovou organizaci, která tyto, dříve chybějící služby, v Příbrami zajišťuje. I v letoším roce v započaté práci pokračujeme s cílem udržet či rozšířit počet dotovaných lekcí a nabídku pohybových aktivit i nadále rozšiřovat., CÍL, CÍLOVÝ STAV PROJEKTU:, Cílový stav jsou aktivní senioři, kteří si uvědomují vlastní zodpovědnost za svůj zdravotní stav, pravidelně navštěvují lekce cvičení či pochodů s hůlkami. , CÍLOVÁ SKUPINA:, , 1. primárně senioři po dosažení důchodového věku (65+), 2. sekundárně rodiny seniorů, na které bude mít soběstačnost seniorů pozitivní dopad a taktéž stát (město), které nebude muset na péči o nemocné a nesoběstačné seniory vynakládat takové prostředky., S naším programem jsme schopni uspokojit přibližně 200 seniorů každý týden., METODY REALIZACE PROJEKTU:, , , , 1. Lekce zdravotního tělocviku s instruktorem, (6 lekcí týdně, kapacita 20 osob/lekce, celkem 120 seniorů), , 2. Lekce nordic walking (chůze s hůlkami), (2 lekce týdně, kapacita 20 osob/lekce, celkem 40 seniorů), Lekce budou realizovány na SZM Příbram - zrcadlový sál Zimního stadionu. V dopoledních hodinách,  ČASOVÝ HARMONOGRAM PROJEKTU:, , Cvičební lekce jsou organizovány v průběhu celého roku (kromě školních prázdnin a svátků), pravidelně každý týden., , Použit je TRIMESTROVÝ model., I. trimestr (leden-březen), II. trimestr (duben-červen), III. trimestr (září-prosinec), DALŠÍ PŘÍNOSY PROJEKTU:, , Cvičení se pozitivně odrazí na zdravotním stavu seniorů - na funkci pohybového aparátu, kloubní pohyblivosti, pohyb působí jako prevence civilizačních chorob, má pozitivní vliv na kardiorespirační a nervosvalový systém a samozřejmě také na nadváhu., , Dále nesmíme opomíjet sociální aspekt společných pohybových aktivit seniorů - senioři si udržují pravidelné “povinnosti”, režim, setkávají se s vrstevníky stejných zájmů. Nezůstávají tak sedět před TV a nechodí si popovídat k doktorům. Mají větší kontrolu nad svým zdravotním stavem a uvědomují si, že je z velké míry v jejich rukou., SPOLUÚČAST SENIORŮ:, , Finanční spoluúčast seniorů je částka 200.- Kč/trimestr. , Za tuto částku absolvují senioři 12-13 lekcí cvičení v průběhu celého trimestru. Cena za jednu lekci tak pro ně je 16.- Kč. Komerční cena za lekci se pohybuje v Příbrami v rozmezí 60 - 100.- Kč/lekci. V případě zaplacení všech tří trimestrů najednou, bude cena zvýhodněna na 550.- Kč/rok (namísto 600.- Kč), Finanční spoluúčastí chceme seniory motivovat k pravidelnosti, ale přesto jim poskytnout velmi zvýhodněné podmínky. , STRUČNÉ SHRNUTÍ PROJEKTU:, , Zařadíme sport do denního života seniorů a motivujeme je k aktivnímu přístupu ke svému zdravotnímu stavu., Kurzy probíhají pod vedením kvalifikovaných lektorů fitness nebo fyzioterapeutů., , , ","neschváleno RK","169000","50000","","29.58579882","","",""
"Kulturní aktivity","2016","FHT/PHT/030429/2016","Podpora Festivalu Jarmily Novotné - koncertní židle","Zámek Liteň, z.s. je nezisková organizace, jejímž posláním je obnovit povědomí o světové operní hvězdě, významné osobnosti a velké vlastence Jarmile Novotné a rodu Daubků v České republice. Každoročně pořádáme v areálu Zámku Liteň mnoho akcí, při kterých potřebujeme mít k dispozici větší počet židlí. , Mezi opakující se akce Festivalu Jarmily Novotné patří:, 1. mistrovské kurzy - podporujeme mladé nadějné operní pěvce. Pořádáme pro ně týdenní pěvecké kurzy v liteňském areálu, kde ve spolupráci se zkušenými lektory zlepšují své dovednosti. Slavnostním zakončením kurzů je společný koncert studentů a pedagogů v Čechovně v zámeckém areálu. 2. koncerty v rámci festivalového víkendu v prostorách areálu (venkovní i vnitřní akce),, 3. přednášky o životě a díle Jarmily Novotné (spisovatel P. Kosatík, filmová historička M. Nedvědová aj.),, 4. návštěvy zámeckého areálu (studenti, senioři atd.), 5. komunitní akce ve spolupráci s obcí Liteň (dětský den, čarodějnice, Běh Litní, hasičský den, školení hasičů)., Na všechny tyto akce si opakovaně půjčujeme židle, které musíme do zámeckého areálu nechat přivézt dopravcem. Cena půjčovného židlí (200 ks) je za jeden den 16.000,- Kč, cena dopravy je 5.600,- Kč. Tento náklad se každoročně v našem rozpočtu opakuje a je pro nás zásadní. Přitom si naše nezisková organizace nemůže dovolit jednorázový výdaj spojený s nákupem židlí, který by byl ve výši 100.000,- Kč (cena 499,- / 1 židle). Proto bychom rádi touto cestou požádali o poskytnutí dotace z Fondu hejtmana. Rozpočet Festivalu Jarmily Novotné pro rok 2016 je 450.000,- Kč. ","neschváleno RK","450000","100000","","22.22222222","","",""
"Rekonstrukce v souvislosti se sociální, kulturní, sportovní a vzdělávací činností","2016","FHT/PHT/030547/2016","Sanace interiéru  a osazení oken ochrannou sítí - kostel sv. Maří Magdaleny v Chlumíně","Sanace interiéru, vč. prostor věže (nutná výšková technika) provedená odbornou firmou, Osazení oken ochrannou sítí proti vletu holubů. Vzhledem k dlohodobému nevyužívání objeku a absenci alespoň základní údržby původním vlastníkem (ŘKC)  není možné započít s opravami a využitím objektu pro značné znečištění holibím trusem a uhynulými holuby. Zdravotní riziko!!! ","neschváleno RK","539303","200000","","37.08490403","","",""
"Vzdělávání","2016","FHT/PHT/030430/2016","Vybavení tří venkovních učeben","Škola zakoupí kvalitní venkovní sedací sety z tvrdého dřeva (tj. stůl pevně spojený se dvěma lavicemi pro 4 žáky). Cílem je umožnit žákům ZŠ. ŠD i ŠK vzdělávání ve venkovním prostředí školních átrií. Vybavení bude také sloužit pro volnočasové aktivity žáků i během přestávek.","neschváleno RK","109230","100000","","91.54994049","","",""
"Sportovní aktivity","2016","FHT/PHT/030442/2016","Pražský triatlonový víkend (TRI Prague)","Česká triatlonová asociace zorganizuje ""Pražský triatlonový víkend"" (29.-31.7.2016) se sérií triatlonových akcí pro různé věkové kategorie. Zejména pak hlavní triatlonový závod ve středně dlouhém triatlonu, který bude pro Prahu a Středočeský kraj významnou sportovní událostí nejen v tomto roce, ale stane se pravidelnou světovou akcí s aspirací na statut IM či Chalange světové série. Program - sobota 30. 7. 2016 7:00 - 9:00 Registrace - pouze pro předem přihlášené 9:00 Start MINI TRIPrague (Střelecký ostrov) 9:00 - 20:00 Sport Expo 10:00 - 11:30 Otevřené depo k uložení kol 12:00 - 12:20 Race briefing TRIPrague- hlavní závod, povinný pro všechny závodníky 13:00 Start TRIPrague - hlavní závod (Střelecký ostrov) 13:15 Start TRIPrague - štafety (Střelecký ostrov) 13:00 - 20:30 TRIPrague - hlavní závod 18:00 - 21:00 Otevřené depo k vyzvednutí kol 20:30 - 21:30 Medailový ceremoniál  Finish line Party ","neschváleno RK","4960000","200000","","4.03225806","","",""
"Sportovní aktivity","2016","FHT/PHT/030591/2016","Sportovní vybavení pro děti i dospělé","Vybavení sportovního areálu bezpečnou tréninkovou brankou soutěžních rozměrů,sítě do branek na hřišti a na tréninkovou branku,vybavení pro lajnování hřiště latexem,bezpečnostní síť.","neschváleno RK","50000","45000","","90","","",""
"Podpora činnosti","2016","FHT/PHT/030587/2016","Podpora aistenčního psa Páji","Finanční podpora asistenčního psa Páji. Jde o úhradu spojenou s náklady na asistenčního pejska Páju.","neschváleno RK","100000","80000","","80","","",""
"Sportovní aktivity","2016","FHT/PHT/030615/2016","Účast na mistrovství světa seniorů v šachu","Zúčastním se Mistrovství světa seniorů v šachu, které se uskuteční v Mariánských Lázních. Budu hrát  kategorii open 50, kde je přihlášeno 160 hráčů.  Podle turnajových pravidel je turnaj otevřený všem registrovaným hráčům splňujícím podmínku věku, bez ohledu na rating a titul. Jsem registrován v ŠK Kladno a budu tak reprezentovat i Středočeský kraj.  Mistrovství se hraje švýcarským systémem na 11 kol. Národní ratingy se při losování neberou v úvahu. Tempo hry je 2x 1,5 h/40 + 30 min + 30 s / tah. , Turnaj se koná v termínu 18. 11. – 1. 12. 2016. Slavnostní zahájení je 19. 11. 2016, závěrečný ceremoniál je 30. 11. 2016 večer., Turnajový program, , pátek	,   18. 11.   příjezd                 , pátek 	18. 11. 	12:00 – 22:00 	osobní registrace , sobota 	19. 11. 	11:00 zahájení	, sobota 	19. 11. 	15:00 	1. kolo , neděle 	20. 11. 	15:00 	2. kolo , pondělí 	21. 11. 	15:00 	3. kolo , úterý 	22. 11. 	15:00 	4. kolo , středa 	23. 11. 	15:00 	5. kol , čtvrtek 	24. 11. 	15:00 	6. kolo , pátek 	25. 11. 	volný den – výlet do Prahy, rapid turnaj 	, sobota 	26. 11. 	15:00 	7. kolo , neděle 	27. 11 	15:00 	8. kolo , pondělí 	28. 11. 	15:00 	9. kolo , úterý 	29. 11. 	15:00 	10. kolo , středa 	30. 11. 	13:00 	11. kolo , středa 	30. 11. 	20:00  vyhlášení	, čtvrtek 	1. 12. 	            odjezd 	, Náklady na mistrovství tvoří startovné, ubytování, stravné a doprava na mistrovství a zpět.","neschváleno RK","10718","9730","","90.78186229","","",""
"Podpora činnosti","2016","FHT/PHT/030448/2016","Pořízení vybavení pro Cestu integrace, o.p.s.","Jsme obecně prospěšnou společností Cesta integrace, o.p.s. Našim obecným cílem je přispívat k rozvoji nových a netradičních metod sociální práce. Prostřednictvím komunitní práce napomáháme ohroženým skupinám obyvatel k aktivní seberealizaci. Našimi projekty jsou například Občanská poradna Říčany a Benešov a Klub Cesta., , Dále s Probační a mediační službou ČR a Partners Czech, o.p.s. též každoročně spolupracujeme na realizaci probačního a resocializačního programu ""Právo pro každý den"" pro delikventní mládež. Každoročně se také podílíme na řadě akcí pro veřejnost, jako např. Evropský týden mobility, Sběr hliníku, Dětský den. Organizuje Světový den bez tabáku či Den bez úrazů., , Občanská poradna Říčany a Benešov poskytuje všeobecné odborné sociální a právní poradenství a poradenství obětem trestných činů a domácího násilí dle zákona 45/2013 Sb. o obětech trestných činů. Služba má registraci sociální služby v oblasti „odborné sociální poradenství“ a dále akreditaci od Ministerstva spravedlnosti ČR na pomoc obětem trestných činů. Služba je pro klienty – uživatele sociálních služeb bezplatná. Občanská poradna pracuje na principech nestranné, nezávislé, důvěrné a bezplatné pomoci všem z vymezené cílové skupiny nad 15 let, kteří potřebují řešit nepříznivou životní situaci., , Obětem trestných činů, svědkům, pozůstalým či blízkým osobám poskytujeme pomoc na základě jejich potřeb v případech konkrétní trestné činnosti. Pomáháme poškozeným v uplatnění jejich práv, například při zastupování zmocněncem, při řešení náhrady škody a získání peněžité pomoci. Velká část klientů Občanské poradny Říčany a Benešov řeší svou složitou životní situaci v poradně opakovaně a dlouhodobě. Pozorujeme nejvíce oblastí konzultací v tématu dluhů a rodiny i majetkových poměrů. Ročně se počet konzultací pohybuje okolo 950 lidí, počet klientů, kteří řeší situaci s OP opakovaně bývá kolem 400 lidí., , Klub Cesta provozuje sociální službu „nízkoprahové zařízení pro děti a mládež“. Cílovou skupinou jsou děti a mladí lidé z Říčan a okolí ve věku 7 až 26 let, kteří hledají, jak smysluplně naplnit svůj volný čas a jak se zorientovat v okolním světě., , V rámci NZDM nabízíme pomoc a podporu v obtížných životních situacích, bezpečný prostor a vybavení pro smysluplné využití volného času a pořádáme i jednorázové hudební, výtvarné i sportovní akce. V případě potřeby poskytujeme doučování látky, na kterou stačíme a pomáháme s přípravami referátů a vypracováváním domácích úkolů., , Snažíme se, aby děti a mladí lidé zažívali obtížné situace v co nejmenší míře a byli si vědomi potencionálních rizik. K dětem i mladým lidem volíme individuální přístup, a přizpůsobujeme tedy službu každému jeho požadavkům. Služby jsou pro klienty bezplatné., , Ročně nás navštíví kolem 150 klientů z většiny opakované a dlouhodobě. Počet intervencí se pohybuje okolo 700 lidí., , Zabýváme se i dopravní výchovou - cílem dopravní výchovy pro žáky 4. tříd naučit děti správnému pohybu na silnici. Výuka je zaměřena na rozvoj praktických dovedností, zručnosti a teoretických vědomostí, které jsou nezbytné pro bezpečný pohyb na vozovce. Při výuce se vychází z tematického plánu dopravní výchovy dle metodiky BESIP – Ministerstva dopravy. Každoročně obsluhujeme přibližně 1300 žáků – 15 škol., Pro zajištění provozu sociálních služeb Cesty integrace, o.p.s. se potýkáme i s potřebou zajistit odpovídající vybavení pro služby. Některé nám chybí, další dosluhují. Jelikož z provozních dotací se nám pro letošní rok prozatím nepodařilo zajistit dostatečné finanční prostředky, rádi bychom tímto požádali o podporu v rámci Fondu hejtmana. Dotace, které jsme doposud pro letošní rok obdrželi, jsou zejména na zajištění základního provozu ( mzdy zaměstnanců, nájemné prostor, energie, ekonomické a právní služby, hovorné, internet, apod.)., , Naše žádost je zaměřená na vybavení pro Občanskou poradnu v Říčanech a Benešově, dále pro nízkoprahový Klub Cesta, provozovaný v Říčanech. Zmíněné sociální služby jsou poskytovány dle zákona o sociálních službách, mají příslušnou registraci poskytovatele sociálních služeb a dále pověření od Středočeského kraje. Dále v žádosti uvádíme interaktivní tabuli, která by sloužila pro výuku dopravní výchovypro 4.ročníky cca 15 základních škol z regionu Říčanska, kterou ročně absolvuje cca 1300 dětí a program NZDM Klub Cesta., , Pro Občanskou poradnu ( pracoviště v Říčanech a Benešově) konkrétně potřebujeme zakoupit 1 notebook a software Windows a Office, poněvadž stávající vypovídá službu. Notebooky potřebujeme ke každodenní práci s klienty naší poradny. Poradna se každoročně v Říčanech a Benešově věnuje cca 400 klientům. Dále v žádosti uvádíme stůl na stolní tenis, který by sloužil pro činnost NZDM Klubu Cesta v rámci aktivizačních činností s klienty, kterých je každoročně cca 140. Pro potřeby NZDM rovněž žádáme o nákup vysavače pro celkový úklid klubu, stávající vysavač dosluhuje.","neschváleno RK","109000","100000","","91.74311927","","",""
"Pořízení vybavení pro sociální, kulturní, sportovní a vzdělávací aktivity","2016","FHT/PHT/030453/2016","Zlepšení vybavení jednotky SDH Kamýk nad Vltavou","Zlepšení vybavení jednotky SDH Kamýk nad Vltavou je projekt, který umožní celé jednotce se zapojit do výjezdů k požárům a záchranným akcím. Jednotka JPO SDH Kamýk nad Vltavou se rozrůstá, daří se získávat nové členy nejen do jednotky, ale i do SDH. Počet členů se SDH Kamýk nad Vltavou se v posledních dvou letech zvýšil z 24 členů na 43. Začalo se scházet družstvo žen, juniorů a dětí. Jednotka JPO III pravidelně cvičí, mají brigády v hasičské zbrojnici, starosta obce dvakrát ročně vyhlašuje tajný cvičný poplach na prověření akceschopnosti jednotky a ve spolupráci s podnikateli v obci, kdy je hašen požár v jejich objektu. Průměrný počet výjezdů je 9 za rok, nicméně v roce 2013 jednotka 14 dnů pracovala na odstranění následků povodně, na vyčerpávání sklepů, odklízení naplavenin a čerpání vody ze zaplaveného fotbalového hřiště. V roce 2014 odstraňovali členové následky bleskové povodně a naplavené nečistoty z komunikací. Realizace podávaného projektu bude zahájena v srpnu 2016 zadáním a rozesláním poptávkového řízení. Po výběru dodavatele a schválení na jednání rady obce bude proveden nákup vybavení a jeho předání jednotce SDH. Na projektu se budou podílet starosta obce, starosta SDH Kamýk nad Vltavou, velitel jednotky JPOIII a dva velitelé družstva. Seznam požadovaného vybavení pro jednotku SDH  1. kukla do přilby ks 10 , 2. zásahová obuv ks 4 , 3. zásahové rukavice ks 5 , 4. zásahová přilba ks 5 , 5. zásahový oděv komplet  ks 3 , ","neschváleno RK","149500","125000","","83.61204013","","",""
"Kulturní aktivity","2016","FHT/PHT/030464/2016","PivoTest Nymburk","Festival dobré muziky a piva v Nymburce. Místo konání: hřiště ""starý"" Polaban, ulice Maršála Koněva . Na akci vystoupí 12 kapel a návštěvníci budou moci ochutnat více než 20 druhů piv od devíti pivovarů. Krom domácího Postřižinského pivovaru se jedná hlavně o mini a střední pivovary.","neschváleno RK","340000","80000","","23.52941176","","",""
"Kulturní aktivity","2016","FHT/PHT/030467/2016","Indiánské léto - 2. ročník","2. ročník festivalu pro celou rodinu ""Indiánské léto"" navazuje na úspěšný úvodní ročník festivalu. Cílem je nabídnout dětem i dospělým z obce  a okolního regionu nové nevšední zážitky a podněty, přinést kvalitní kulturní a společenskou zábavu, budovat a posilovat nové tradice, přispět ke společnému setkávání, poznávání  a zážitků. Dramaturgie realizace: inscenace představení pro celou rodinu na motivy Karla Maye Vinnetou, pokrevní bratrství, pohádka pro děti s písničkami Á -Á- Á, vystoupení s lasem, bičem - zručnosti, soutěž pro děti, hudební songy, tradice, zábava vše propojeno společným tématem indiánů.","neschváleno RK","27370","20000","","73.07270734","","",""
"Vzdělávání","2016","FHT/PHT/030469/2016","Jednosemestrální studijní pobyt na National Chengchi University na Taiwanu","Jsem studentem VŠE v Praze a skrz výběrové řízení jsem se dostal na prestižní National Chengchi University (dále NCCU) na Taiwanu, abych tam 5 měsíců (září 2016 až leden 2017) studoval. Svými výsledky patřím k nejlepším studentům v ročníku. Kromě studia (v angličtině) bude tento semestr velkou příležitostí pro kulturní výměnu s lidmi ze zcela odlišných kultur, a zároveň možnost nahlédnout díky místním odborníkům blíže do budoucího globálního ekonomického centra, kterým se východní Asie stává. VŠE pomáhá s komunikací s NCCU a poskytuje určitou finanční pomoc, která však zdaleka nepokrývá náklady daného pobytu. Proto bych rád získal prostředky z Fondu hejtmana, jelikož tato akce je v souladu s vypsanými tématy fondu. Jsem si vědom toho, že takové studium je dobrovolné a tudíž ponesu většinu nákladů sám, zároveň je finanční pomoc částečně poskytována školou, dar z Fondu hejtmana by ovšem byl vítanou pomocí s i tak vysokými náklady studia.","neschváleno RK","150000","30000","","20","","",""
"Kulturní aktivity","2016","FHT/PHT/030471/2016","Noir Film Festival 2016","NOIR FILM FESTIVAL je unikátní filmová akce (i v evropském měřítku) s nezaměnitelnou atmosférou, jejíž 4. ročník se uskuteční od 18. do 21. srpna 2016 ve čtyřech sálech a na nádvoří královského hradu Křivoklát. Festival spojuje významné místo české historie a nadčasový filmový žánr - film noir. Umožňuje českým i zahraničním návštěvníkům zhlédnout snímky především z klasického období filmu, z nichž mnohé dosud nebyly v ČR uvedeny a na festivalu tak budou mít až po mnoha letech svou kinopremiéru. , Charakter festivalu umocňují prostory středověkého hradu, v nichž všechny filmové projekce probíhají, zejména potom jeho horní nádvoří., Většina (letos 95 %) festivalových titulů je uváděna v originálním znění s českými nebo anglickými titulky. , Čtyři dny, pět promítacích míst, čtyřicet projekcí, projekce němého filmu z roku 1912 s živou hudbou, divadelní představení „Ještěrka na slunci“ a seminář věnovaný Otto Premingerovi - to jsou jen některá fakta připravovaného 4. ročníku festivalu, jehož patrony jsou herecké naděje Marika Šoposká a Šárka Vaculíková, herec Jan Šťastný nebo režisér Jiří Strach, který na Křivoklátě uvede svůj úspěšný televizní film z roku 2002 ""Vyvraždění rodiny Greenů"". Letošní ročník dále podpoří svou účastí např. herečky Hana Maciuchová, Vilma Cibulková, herci Jaroslav Satoranský, Jiří Dvořák a Tomáš Hanák a režisér Václav Marhoul, který se stal po Davidu Ondříčkovi loňským držitelem festivalové ceny „Noirové oko“ za současný pohled na film noir., , Hlavním cílem festivalu je i nadále přibližovat jeho návštěvníkům zvláštnosti i společné prvky filmu noir, který již po mnoho desetiletí fascinuje diváky a inspiruje filmaře po celém světě, letos např. prostřednictvím „freudovského noiru“, „noirových westernů“ nebo retrospektivy režiséra Otto Premingera. Dalším cílem je poukazovat na zajímavé žánrové přesahy do současného filmu - v rámci programu 4. ročníku například v podobě programové sekce věnované snímkům natočeným podle knih Jamese Ellroye. Jedna ze sekcí bude věnována i československému/českému „televiznímu noiru“., Festival má současně i vzdělávací ambice. Pro každý ze tří již uskutečněných ročníků byl vydán obsáhlý festivalový katalog, obsahující informace o promítaných filmech a jednotlivých programových sekcích. Všechny projekce jsou navíc uvedeny krátkými lektorskými předmluvami, které diváka seznámí s profilem režiséra, herců či souvislostmi a dobou, ve které byl snímek natočen.  , I letos tak budou mít domácí a zahraniční návštěvníci Křivoklátu jedinečnou možnost spojit prohlídku gotických hradních paláců a věží s filmovými zážitky noirových projekcí., , Nad všemi ročníky festivalu převzali svou záštitu Ministerstvo kultury ČR a hejtman Středočeského kraje., Významnými partnery festivalu jsou např.: Národní památkový ústav, HBO Europe, s.r.o., ČSOB, a.s., RWE Česká republika a.s., Česká televize, cestovní kancelář FIRO-tour a.s. nebo Vinné sklepy Valtice, a.s. , , Plán realizace:,   1.1. - 17.8. 2016, aktivní příprava festivalu, 18.8. - 21.8. 2016, konání festivalu,       18.8. - ofic. zahájení festivalu, horní nádvoří hradu Křivoklát (od 21.15 hod.),       21.8. - zakončení festivalu, sál Kirka Douglase (od 15.30 hod.), 22.8. - 30.11. 2016, vypořádání závazků a vyhodnocení akce , , Dramaturgický záměr, Program pro rok 2016 je organizován kolem nosných témat (např. Freudovský noir, noirový western nebo San Francisco noir), zásadních osobností (Otto Preminger, James Ellroy) nebo národních kinematograﬁí (československý/český TV noir, německý noir). Kompletní program 4. ročníku - viz příloha, , Více informací o festivalu je možné najít na www.noirfilmfestival.cz nebo v přílohách.","neschváleno RK","1228000","75000","","6.10749186","","",""
