"Kulturní aktivity","2016","FHT/PHT/030117/2016","5. Majáles Gymnázia Hostivice","Kulturní akce Gymnázia Hostivice, kde budou šerpování noví studenti školy + kulturní program studentů školy, které proběhne na velkém pódiu. Tuto kulturní akci pořádá náš spolek.","neschváleno RK","23000","19780","","86","","",""
"Rekonstrukce v souvislosti se sociální, kulturní, sportovní a vzdělávací činností","2016","FHT/PHT/030118/2016","Klempířské práce a izolační práce","Jedná se o opravy oplechování říms, střechy a ochozů budovy TJ. Dále budou provedeny izolační opravy ochozů a přístupových míst na budově. ","neschváleno RK","220000","200000","","90.90909091","","",""
"Sportovní aktivity","2016","FHT/PHT/030124/2016","Mistrovství Středočeského kraje 2016 v cyklistických disciplínách BMX, MTB XCO a cyklokros","Z pověření Českého svazu cyklistiky je Středočeský svaz cyklistiky garantem závodů Mistrovství Středočeského kraje v jednotlivých cyklistických disciplínách., Na přímé organizaci jednotlivých závodů spolupracuje SČSC s organizátory v místě konání a společně s nimi se podílí na relizaci akcí a to dle schválených propozic závodu., Termíny a místa mistrovských závodů v roce 2016:, Mistrovství Středočeského kraje BMX - Benátky nad Jizerou, 28. května 2016, Mistrovství Středočeského kraje MTB XCO - Beckov, 5. června 2016, Mistrovství Středočeského kraje cyklokros - Holé Vrchy, 5. listopadu 2016","neschváleno RK","65000","60000","","92.30769231","","",""
"Kulturní aktivity","2016","FHT/PHT/030127/2016","Žijeme PRO - Olympijský běh","V roce 2016 v rámci jubilea 800 let města Příbram chceme přispět a obnovit část parku v části Příbram – Brod, obnovit kříž na poutní cestě z Bavorska na Svatou Horu a podílet se na vytvoření česko-německé publikace o Příbrami a bavorském Bodenmais (aktivity 18. srpen až 31. prosinec)., Součástí projektu je i charitativní běh Olympijský běh - Příbram, který vyhlašuje Český olympijský výbor na podporu zdravého životního stylu a podpory olympijských myšlenek 22. června. , Již od roku 2009 organizujeme Studentskou TOUR Cyklopouť Příbram - Bodenmais. V roce 2013 jsme realizovali naučnou stezku „Po stopách politických vězňů“ (okruh Svatá Hora – Brod – Žežice – Lešetice – Památník Vojna) s vzdělávacím obsahem pro mladé. , Na financování projektu jsme předběžně dohodnuti s Česko-německým fondem budoucnosti, Nadací Renovabis, Českým olympijským výborem, městem Příbram a Bodenmais., Byla podána žádost o záštitu hejtmana Středočeského kraje, veškeré akce přispějí k pozitivnímu vnímání kraje nejen v ČR, ale i v zahraničí., ","neschváleno RK","201500","15000","","7.44416873","","",""
"Kulturní aktivity","2016","FHT/PHT/030128/2016","Soubor Kulturně společenských akcí v Mlékojedech u Neratovic","AKCE 1, -----------------, -----------------, , Mlékojedská Padesátka- Fichtl Cup 2016 , - konání akce: 6.8.2016, - předpokládaný počet návštěvníků: 2000 lidí, - místo konání- Mlékojedy- Neratovice, , Stručná charakteristika akce:, , Jedná se o již pátý ročník neziskové sportovní soutěže malých motocyklů. Je pořádána pro širokou veřejnost a závodníci i návštěvníci se sjíždějí prakticky z celých Čech. Akce se stala v průběhu minulých let velmi populární a návštěvníků stále přibývá. Akce probíhá 3 dny včetně příprav a úklidu. Na přípravách a organizaci se podílí hlavně sami místní občané společně s občanským sdružením rotunda a motokrosovým klubem Mlékojedy., , 5.8. - příprava tratí, stavba depa, stavba bezpečnostních prvků a zábran, pódia, zázemí pro realizační tým., , 6.8. - dopoledne přejímka strojů, 12:00 rozprava se závodníky, zaváděcí jízda. 13:00 start závodu. V odpoledním čase ukončení závodů, vyhodnocení výsledků všech kategorií. Večer vyhlášení výsledků a předání cen. Během celého dne probíhá také doprovodný program pro návštěvníky ( skákací hrad pro děti + dětské soutěže, mobilní bazén, hudební program v podobě dvou vystupujících kapel.) a to až do pozdních nočních hodin., , 7.8. Demontáž všech prvků použitých na akci a celkový úklid. , , Na akci dohlíží také zdravotnická služba a hasiči., -------------------------------------------------------------------------------------------------, , , , , AKCE 2, ------------, ------------, , Mlékojedská pouť, , - konání akce: 12-14.8., - návštěvnost: 1200 lidí, - místo konání : fotbalové hřiště, , Stručná charakteristika akce:, , Tato akce je nezisková a navazuje na tradičně konané místní poutě., Je zaměřena hlavně na děti a to všech věkových kategorií., , 12.8. - Pouťové atrakce, , 13.8. - slavnostní zahájení poutě, začíná raní bohoslužbou u místní kapličky., V průběhu dne probíhá pouťové veselí, které vrcholí večerní pouťovou zábavou a hudebním vystoupením místních kapel., , 14.8.- celý den probíhá pouťové veselí a akce je ukončena večerním divadelním představením místních ochotníků., ------------------------------------------------------------------------------------------------, , , , , , , , , AKCE 3, ----------, ----------, , Bleší trh, , - konání akce: 10.9., - návštěvnost 600 lidí, - místo konání: náves, , Stručná charakteristika akce:, , Populární nezisková společenská akce, pořádána za účelem setkávání místních občanů., Na této akci mají občané možnost kromě setkávání, prodávat a směňovat různé předměty( knihy, oblečení, dětské oblečení, hračky, sportovní potřeby atd.) , Akce je oblíbena hlavně mezi dětmi a mládeží., -------------------------------------------------------------------------------------------------, , , , , , , , , , , , , , AKCE 4, -----------, ----------, , Dýňová slavnost, , - konání akce: 5.11., - návštěvnost: 300-500 lidí, - místo konání: Mlékojedy, , Stručná charakteristika akce:, , Společenská nezisková akce k ukončení pěstitelské sezóny., , - Soutěže pro děti všech věkových kategorií, - Soutěž o nejkrásnější vyřezávanou dýni, - Stezka odvahy pro děti i dospělé, - Lampionový průvod celou obcí, - ochutnávky výrobků nejen z dýní nabízejí místní hospodyňky, akce se koná od sobotního oběda do večerních hodin., -------------------------------------------------------------------------------------------------, , , , , , , , , , , AKCE 5, -----------, -----------, , Svatomartinské posvícení, , - konání akce: 12.11., - návštěvnost: 250-350 lidí, - místo konání: hasičská zbrojnice, , Stručná charakteristika akce:, , Nezisková kulturně společenská akce s cílem udržení a rozvoje staročeských tradic., Akce je určena pro všechny, kteří mají rádi tradiční zábavu, kuchyni a zvyky., Ukázky tradiční kuchyně, poslech folklorní hudby a ukázky folklorních tanců skupiny ,, Jarošovci Mělník"", -------------------------------------------------------------------------------------------------, , , , , , , , , , , , , , , AKCE 6, -----------, -----------, , Zahájení adventu, , - konání akce: 3.12., - návštěvnost: 400-500 lidí, - místo konání: náves Mlékojedy, , Stručná charakteristika akce:, , Kulturně společenská nezisková akce., - Rozsvěcení vánočních stromů, - Pěvecké vystoupení dětí z mateřské školky, - Pěvecký sbor z místního gymnázia, - společné zpívání koled, - ochutnávky a výměna vánočního cukroví, - pěvecká vystoupení několika místních kapel s vánočními písněmi, - výstava adventních věnců, Akce se koná v průběhu celého dne až do večera, , ","neschváleno RK","150000","95000","","63.33333333","","",""
"Kulturní aktivity","2016","FHT/PHT/030133/2016","kniha ""JAN KUBIŠ - Nezastaví mě ani to nejhorší...""","Kniha předního vojenského historika plk. gšt. PhDr. Eduarda Stehlíka, MBA s názvem ""JAN KUBIŠ - Nezastaví mě ani to nejhorší..."" je věnována rtm. Janu Kubišovi, který společně se Slovákem rtm. Jozefem Gabčíkem v rámci operace ANTHROPOID seskočil u středočeské obce Nehvizdy a v Praze provedl atentát na zastupujícího říšského protektora Reinharda Heydricha. Publikace vyjde u příležitosti 75. výročí zahájení operace ANTHROPOID a na cca 200 stranách představí čtenářům nejen osobnost Jana Kubiše, ale  jeho rodinu, přátele, bojové druhy, spolupracovníky a také jeho protivníky. Kniha bude doplněna velkým množstvím obrazových příloh, z nichž některé budou uveřejněny poprvé. Nakladatelství Tváře - Jitka Průžová připravuje vydání této knihy (formát 225x225 mm) na přelom léta a podzimu tohoto roku. Kniha by měla obohatit novými informacemi nejen zájemce o historii, ale i širokou veřejnost včetně školní mládeže. Středočeskému kraji nabízíme 400 ks těchto knih.","neschváleno RK","288000","100000","","34.72222222","","",""
"Sportovní aktivity","2016","FHT/PHT/030137/2016","Czech Masters 2016","V roce 2012 pořádal velmi úspěšně Putting golf club Úžice, z.s., na svém hřišti Czech Open, a to za přítomnosti štábu České televize, píšících novinářů a širokého zájmu veřejnosti.  , Pro letošní rok obdržel počátkem dubna Putting golf club Úžice, z.s., pověření od nadřízené organizace Czech ProMiniGolf Association k pořádání Czech Masters 2016 v Adventure golfu, které proběhne v areálu v Úžicích u Kralup ve dnech 20. – 21. srpna 2016., Obsazeny budou nejen hlavní kategorie profesionálních hráčů a hráček, ale i kategorie neregistrovaných mužů, žen a mládeže, kde je počítáno s masovou účastí zájemců o tuto sportovní aktivitu, čemuž je také přizpůsobena naše propagační činnost., Z předních světových hráčů, kteří přislíbili předběžně účast, jmenujeme alespoň dva švédské reprezentanty Hanse Olofssona, dvojnásobného vítěze US Masters 2005 a 2006, a Ricarda Locknera, vítěze US Masters 2010., Z českých hráčů je pak nutné jmenovat největší hvězdu posledních pěti let, Olivii Prokopovou z Rakovníka, které je vítězkou US Masters z let 2012 a 2013, vítězkou US Open z let 2011 a 2013 a několikanásobnou mistryní světa., Na jednom hřišti by se tak mohli sejít hned tři vítězové nejprestižnější světové trofeje - zeleného saka, které je určeno vždy jen pro vítěze US Masters., Stalo by se tak premiérově na evropském kontinentu. Dosud se sešli na jednom podniku v ČR pouze Ricard Lockner a Olivia Prokopová, a to při Czech Masters v Horním Bezděkově u Kladna a při Czech Open v Plasích u Plzně.  , Již minimálně týden před každým z podniků bude nutné zajistit zejména zahraničním hráčům a hráčkám a předním českým hráčům a hráčkám ubytování, dopravu a kulturně-společenský program, ve kterém je počítáno mj. s návštěvou hradu Křivoklát, hradu Karlštejn, historické části Rakovníka a hlavního města Prahy., ","neschváleno RK","75000","30000","","40","","",""
"Sportovní aktivity","2016","FHT/PHT/030595/2016","Bezpečná branka pro děti i dospělé","Nákup tréninkové brány soutěžních rozměrů v bezpečnostním provedení + síť.Branka bude využívána žáky a dorostem,ale i dospělými hráči.","neschváleno RK","25000","23000","","92","","",""
"Pořízení vybavení pro sociální, kulturní, sportovní a vzdělávací aktivity","2016","FHT/PHT/030141/2016","Nákup přenosné požární motorové stříkačky","Sbor dobrovolných hasičů v současné době nedisponuje žádnou přenosnou požární motorovou stříkačkou (dále jen ""PS""). Sbor PS potřebuje pro výkon požární jednotky. Při povodních v roce 2013 došlo k poškození čerpadla při čerpání nečistot ze sklepních prostor zatopených objektů. Oprava původní čerpadla se pohybuje v hodnotě nového stroje a jeví se jako varianta neekonomická. Z tohoto důvodu žádáme o pomoc s nákupem nové PS.  ","neschváleno RK","232320","100000","","43.04407713","","",""
"Sportovní aktivity","2016","FHT/PHT/030155/2016","Volejbalový turnaj „Memoriál Jiřího Končela 2016“","V sobotu dne 16. července 2016 uspořádá Sdružení sportovců posázaví volejbalový turnaj „Memoriál Jiřího Končela 2016“. Celodenního volejbalového klání sportovců všech věkových kategorií různých úrovní se zúčastní vybrané týmy a to nejen v působnosti Středočeského kraje., Historie turnaje sahá do roku 1965, od kdy se na travnatých (UMT) hřištích v malebném prostředí Posázaví (okres Kutná Hora) v Kácově tradiční turnaj dříve nazývaný „O štít Kácova“ v odbíjené mužů. Jinak zvaný také jako „Kácovský wimbledon“., Letos se tak bude jednat o 44. ročník kácovských volejbalových klání. Před vlastním turnajem bude stanoven herní systém turnaje. Předpokladem je rozlosování soupeřů do skupin následné pokračování vyřazovacím způsobem. Akce s hojnou účastí diváků bude probíhat ve sportovním areálu v Kácově na čtyřech volejbalových hřištích., O bezproblémový průběh turnaje se budou starat pořadatelé, členové klubu Sdružení sportovců posázaví, jejichž výhodou je znalost prostředí či zkušenosti s každoročním pořádáním obdobných akcí. Celkové náklady na pořádání turnaje se předpokládají ve výši 98 000 Kč. Tato částka vychází z reálných nákladů, které jsou běžně vynakládány na turnaje srovnatelné úrovně. Tímto bychom chtěli požádat pana hejtmana o finanční příspěvek ve výši 80 000 Kč z fondu hejtmana a zároveň o převzetí záštity nad těmito oslavami. Je samozřejmostí, že představitele kraje pozveme na předávání cen. Celá akce bude významně publikována, a to jak na úrovni klubu a města Kácova, ale především u účastníků turnaje včetně jejich doprovodu. Rovněž bude podpora kraje prezentována ve všech nám dostupných médiích.","neschváleno RK","98000","80000","","81.63265306","","",""
"Kulturní aktivity","2016","FHT/PHT/030158/2016","koncert skupiny Hradišťan&Jiří Pavlica","vystoupení skupiny Hradišťan&Jiřího Pavlici spolu s pěveckých souborem z Kněžmosta a dětí ze školy Kněžmost-oslavy 700 let založení obce Kněžmost","neschváleno RK","118640","101640","","85.67093729","","",""
"Rekonstrukce v souvislosti se sociální, kulturní, sportovní a vzdělávací činností","2016","FHT/PHT/030159/2016","Modernizace kotelny v MŠ Knovíz","V kotelně mateřské školy v Knovízi je havarijní stav plynových kotlů. Podle zprávy Plynoservisu je nutná výměna 2 kotlů na vytápění mateřské školy v Knovízi čp. 55 z důvodu časté poruchovosti starých kotlů, které jsou z roku1995 a již byla ukončena výroba náhradních dílů pro tyto kotle. Není proto již zaručen servis a hrozí, že v případě nějaké poruchy by muselo dojít v zimním období k uzavření mateřské školy.","neschváleno RK","241741","193393","","80.00008273","","",""
"Pořízení vybavení pro sociální, kulturní, sportovní a vzdělávací aktivity","2016","FHT/PHT/030164/2016","Pořízení herních prvků pro mateřskou školku","Mateřská školka Milischool se nachází v Milovicích. Školka nabízí dětem a jejich rodičům celou škálu novinek a výhod spolu s vysoce profesním a přátelským prostředím, které výrazně ovlivňuje všestranný rozvoj dítěte a celkově přináší radost z pobytu mimo rodinný kruh. Jednou z novinek je intenzivní výuka anglického jazyka zábavnou a přirozenou formou, dále rozšířená hudební výchova a každodenní setkávání se s hudebním nástrojem. Školka nabízí i odpolední zájmové kroužky a příměstské tábory s výukou angličtiny. , Program školky probíhá každý všední den od 6:00 do 18:00 po celý rok v roce s výjimkou státních svátků a vedením stanovených prázdnin. Jsou přijímány děti již od jednoho roku. Pro tyto děti „jesličkového“ věku je upraven program podle jejich schopností a možností. Do školky lze umístit dítě jak na celodenní docházku, tak pouze na několik dní týdně. , Pedagogové se řídí vzdělávacím školním programem a k dětem přistupují s láskou a péčí přizpůsobenou jejich individuálním potřebám. O děti se stará speciální pedagožka, vysokoškolsky vzdělaní učitelé anglického jazyka, zdravotní sestra a učitelky s několikaletou praxí v mateřských školách. Paní učitelky jsou v naší školce proto, aby dětem předaly ucelené znalosti a podpořily je v získávání a prohlubování dovedností a kladných povahových vlastností., Jde nám o to doplnit rodinnou výchovu a pomoci zajistit dítěti od útlého věku prostředí s dostatkem mnohostranných, přiměřených a odborných podnětů k jeho aktivnímu rozvoji a učení. Snažíme se pro děti a jejich rodiče vytvořit rodinnou atmosféru, ve které by se cítili dobře. Děti učíme vnímat svět kolem nás s klady i zápory, umět se orientovat v tomto světě a mít ve svém srdci velké místo pro lásku a přátelství. Základem naší práce je prostředí vzájemné důvěry, respektu, vytvoření zdravého sebevědomí u dětí a položení základu nejenom celoživotního vzdělávání, ale hlavně sociální a emoční inteligence., Během roku se ve školním vzdělávacím programu prostřídá několik tematických celků zaměřených jak na sociální stránku rozvoje dítěte, tak na správné životní návyky a samozřejmě na rozšiřování vědomostí., , Předmětem projektové žádosti je obnova hracích prvků v naší mateřské školce. Část stávajících hracích prvků se blíží za hranici své životnosti a některé byly dokonce již vyřazeny z užívání, neboť hrozilo nebezpečí úrazu. Vedení školy se snaží své příjmy investovat především do provozních nákladů a personálního zabezpečení školky. Tímto krokem nezbývá již mnoho investičních finančních prostředků na nákup nových hraček a vybavení pro děti. Proto se vedení školky rozhodlo podat žádost o finančních dotaci za podpory Středočeského kraje k nákupu hracích prvků., ","neschváleno RK","113311","107000","","94.43037304","","",""
"Sportovní aktivity","2016","FHT/PHT/030166/2016","Zajištění provozních výdajů pro rok 2016","Sportovní areál SK Nučice je multifunkční areál, ve kterém fungují oddíly kopané, tenisu a volejbalu NUČIC. Sportovní klub vychovává a podporuje nejenom mladé sportovce již více než 25 let. , Součástí areálu jsou čtyři antukové kurty, sportovní hala s parketovým povrchem,  fotbalové hřiště a volejbalové hřiště. V současné době má členská základna 78 dospělých členů a 58 mládežnických členů. Sportovní týmy hrají své pravidelné soutěže a také se účastní mnoha venkovních nebo halových turnajů. Převážná část členů tenisového klubu reprezentuje TJ Sokol Nučice na mistrovských utkáních. Oddíly se stále rozrůstají a počet zájemců o sporty roste. Nyní v klubu funguje i tenisová školička, do které probíhá celoroční nábor. , S vysokým zájmem o sportovní aktivity, zejména z řad dětí a mládeže rostou i provozní náklady. , Největší náklady na energie jsou spojené s provozem haly, která od dob své výstavby prošla jen nejnutnějšími opravami a v současné době neodpovídá aktuálním standardům, zejména po stránce energetické náročnosti. Na rekonstrukci haly aktuálně zpracováváme projektovou dokumentaci a samotná rekonstrukce proběhne v nadcházejících letech, náš klub tak čeká nemalá investice. , Další výdaje kromě nákladů na energie, jsou spojené zejména s údržbou sportovišť vč. sportovní haly. Vzhledem k tomu, že sportovní halu využívá i místní ZŠ, která nemá tělocvičnu, je třeba udržovat halu v rámci možností v udržitelném stavu. Samotná údržba sportovišť je největší položkou v rozpočtu klubu. Z toho důvodů žádáme o dotaci na podporu činnosti klubu spojenou zejména se zajištěním finančních prostředků na provozní výdaje klubu., ","neschváleno RK","562701","150000","","26.65714118","","",""
"Kulturní aktivity","2016","FHT/PHT/030173/2016","Oslavy 750. výročí založení obce Čakovičky.","Dne 25.6.2016 proběhnou v obci Čakovičky oslavy 750. výročí založení obce. Na tuto, slavnost budou pozváni nejen místní občané, ale rodáci i pamětníci z blízkého i dalekého, okolí. Akce podpoří podvědomí občanů nejen o obci Čakovičky , ale i Středočeského, kraje, kde se obec nachází. K těmto oslavám bychom rádi vydali brožurku o naší obci,, zorganizovali výstavku z historie naší obce a součástí bude doprovodný kulturní program, nejen pro dospělé, ale i pro děti, které se budou moci zúčastnit také soutěží, ve kterých, nebude chybět ani vědomostní kvíz z historie obce Čakovičky a Středočeského kraje,, jako místa, kde žijeme. Součástí akce bude doprovodný program s ukázkou historických, řemesel. Oslavy budou ukončeny večerní taneční zábavou. Rádi bychom touto cestou požádali o finanční příspěvek z Fondu hejtmana.","neschváleno RK","115000","100000","","86.95652174","","",""
"Pořízení vybavení pro sociální, kulturní, sportovní a vzdělávací aktivity","2016","FHT/PHT/030174/2016","Osobní automobil pro domácí hospicovou péči","Předpokladem zajištění poskytování domácí hospicové péče je schopnost zaměstnanců poskytovatele se operativně a velmi rychle dopravit do bydlišť (domácností) pacientů. V současné době naše společnost pro tento účel vlastní pouze dva osobní automobily. Pro poskytování naší péče na teritoriu šesti okresů, kde jsme doposud působili (a toto teritorium se snažíme systematicky rozšiřovat) je tento stav zcela nedostačující. Situaci dokážeme částečně řešit tak, že většina pracovníků používá vlastní automobily, což je ale pro společnost ekonomicky nevýhodné. Mnohem složitější situace však je v případě, že potenciální zaměstnanec nemá k dispozici vlastní automobil. Jeho působení pro Hospic je pak velmi limitované a v některých případech v minulosti z tohoto důvodu nedošlo proto ani k uzavření zaměstnaneckého vztahu s takovým uchazečem., Realizace předkládaného projektu představuje pořízení použitého osobního automobilu s nízkým obsahem motoru prostřednictvím autobazaru (u „ročních“ a „dvouletých“ vozů jejich cena ke kvalitě výrazně klesá) do výše 150.000,- Kč. , Realizace projektu bude představovat průzkum aktuální nabídky autobazarů, které budou vyhovovat našim požadavkům/parametrům na charakteristiku použitého automobilu – malý obsah motoru a cena do 150.000,- Kč s cílem pořídit automobil s nejlepším poměrem cena a kvalita. , ","neschváleno RK","150000","140000","","93.33333333","","",""
"Podpora činnosti","2016","FHT/PHT/030171/2016","klubová činnost spolku pro pomoc lidem s mentálním postižením","Úhrada nákladů na služby/ voda teplo, energie/ v klubových prostorách sídla spolku. V objektu Žežická 193 Příbram VII máme k naší činnosti pronajaté 2 místnosti kde se pravidelně scházíme a pracujeme s mentálně postiženými členy našeho spolku na rozvíjení jemné motoriky,, tělovýchovnou činnost,integrace do společnosti a pod.","neschváleno RK","63000","58000","","92.06349206","","",""
