"Oblast podpory","Rok dotačního titulu","Číslo žádosti","Název projektu","Popis a způsob realizace akce/projektu","Stav žádosti","Celkové náklady","Celková požadovaná dotace celkem v roce 2018","Proplacená dotace (Kč)","Podíl celkové požadované dotace k celkovým nákladům","","",""
"Sportovní aktivity","2016","FHT/PHT/029626/2016","Podpora činnosti oddílu házené TJ Sokol Libčice","Oddíl házené TJ Sokol Libčice bude hrát již pátým rokem 2. ligu v házené. V sezóně 2014 se nám podařilo dokonce celou soutěž vyhrát a bojovali jsme o postup do celostátní 1. ligy. V uplynulém roce jsme skončili na celkovém 3 místě tabulky. Jedná se o velký sportovní úspěch malého města ve Středních Čechách, který ale přináší nemálo sportovních a finančních starostí., , Například 2. ligu je povinností hrát v hale. Protože halu v Libčicích nemáme, budeme tato utkání i tento rok hrát ve Sportovním areálu Hostivice-Břve. To představuje vyšší náklady na provoz (pronájem haly na tréninky, utkání, cestovné, náklady na řízení utkání a další). I díky dotaci od Středočeského kraje se podařilo připravit potřebné podmínky pro oddíl, který se odvděčil vynikajícími výkony. I tento rok tedy bojujeme o body ve 2. lize., , V aktuálním ročníku jsou muži umístěni opět na předních místech tabulky. Cílem je opět bojovat o 1. ligu. Spolu s tím je potřeba zajistit i potřebné finance. Potřebné podmínky pro oddíl bychom bez dotace jen stěží zabezpečili. V případě, že bychom znovu uspěli a byli bychom před rozhodnutím, zda okusit atmosféru 1. ligy, museli bychom zvážit i aktuální situaci rozpočtu oddílu. Již nyní je jisté, že bez případné dotace bychom 1. ligu ""neutáhli"". Sportovní cíl je v našich rukách, ten finanční snad společně také zajistíme.","neschváleno RK","325200","50000","","15.37515375","","","`"
"Kulturní aktivity","2016","FHT/PHT/030275/2016","Nákup hlikových branek","Realizací projektu dojde k pořízení nových fotbalových branek, které nahradí dosavadní staré ocelové brány, které jsou na pokraji své životnosti. Výhodou nákupu hliníkových branek je především vysoká pevnost, nízká váha a odolnost proti korozi. To jsou vlastnosti, které udělaly z hliníku primární materiál pro výrobu moderních fotbalových branek, splňujících poslední standardy. Díky nízké váze se s brankou z hliníku snadněji a především bezpečněji manipuluje. Kvalitně provedené branky z hliníku mají téměř neomezenu životnost. V současné době klub disponuje starými ocelovými brankami, které jsou v pokročilém stádiu, koroze. Brány jsou nebezpečné z hlediska případného nárazu hráčů na ocelové tyče, či tržným poraněním o korozní části branky., Cílem klubu je postupná obnova technického vybavení sportovního klubu Bakov nad Jizerou a budování vhodného a bezpečného prostředí pro výchovu mládeže. Přínosem projektu je, především zvýšení bezpečnosti. Hřiště kromě dvou mužstev dospělých využívají především, mládežnické celky. , ","neschváleno RK","49000","45000","","91.83673469","","",""
"Sportovní aktivity","2016","FHT/PHT/030276/2016","Bělské balónové hemžení 2016","14.ročník setkání horkovzdušných balónů v Bělé pod Bezdězem. Jedná se o 4 denní akci, která veřejnosti přibližuje létání horkovzdušnými balóny, kterých se tento rok sejde 20. Součástí této akce je též kulturně společenský program pro širokou veřejnost, který se koná v sobotu 18.6. 2016 a je završen Ohnivou show.","neschváleno RK","170000","40000","","23.52941176","","",""
"Pořízení vybavení pro sociální, kulturní, sportovní a vzdělávací aktivity","2016","FHT/PHT/030205/2016","Pořízení hmotného majetku pro TJ Tochovice"," Tělovýchovná Jednota Tochovice je největším spolkem v obci Tochovice, který podporuje sportovního ducha svých členů již 75 let. Součástí klubu je běžecký oddíl a několik mužstev, které hrají okresní fotbalové soutěže, klub má více než 200 členů. , Součástí areálu sportovního klubu jsou dvě travnaté plochy a kabiny pro hráče. Vedle areálu je nově vybudována víceúčelová asfaltová plocha. Areál slouží i pro soustředění fotbalových mužstev a odehrávají se zde významné akce, například SliviceCup, turnaj přípravek prvoligových celků. V prostorách areálu několikrát do roka pořádáme fotbalové turnaje, kam se sjíždí i ostatní týmy napříč celým středočeským krajem. Nás běžecký oddíl nás každoročně reprezentuje na Tochovickém krosu „Podrejžím“., V současné době má klub 4 fungující fotbalové týmy, z čehož 3 hrají středočeské soutěže. V našem klubu máme týmy Mladších žáků, A tým, B tým a Starou gardu. V současné době mámě 62 registrovaných členů FAČR a 180 členů celkem. , Potýkáme se s problémy usazování fanoušků a rodičů při pořádání turnajů. Rádi bychom pořídili lavičky a stoly pro fanoušky abychom zpříjemnili podmínky areálu. Naše branky jsou staré a z vlastní výroby klubu, v současné době už nejsou plně funkční. Jejich stáří je přes 30 a museli jsme je již několikrát opravovat a svařovat. Pro děti jsou nevyhovující a může dojít k vážnému kolapsu a zranění hráčů. Rádi bychom zajistili lepší podmínky pro naše členy a pro návštěvníky našeho areálu. Z tohoto důvodu bychom rádi požádali o příspěvek na úhradu hliníkových branek na fotbal a na pořízení laviček a stolů pro fanoušky. Celkové náklady na pořízení majetku činí 179 780,- Kč. ","neschváleno RK","179780","170000","","94.5600178","","",""
"Kulturní aktivity","2016","FHT/PHT/026449/2016","Uhrazení bilboardu ""Hornické pohádky"" umístěného v Praze-Lipence, u Strakonické rychlostní silnice","Uhrazení bilboardu ""Hornické pohádky"", kde bude uvedeno ""Věnováno k 800 let výročí města Příbram"" a informace ""Realiizováno s přispěním Středočeského kraje""  /spoluúčast 5% autora/umístěného v Praze- Lipence,  u Strakonické rychlostní silnice, Ke Štěrkovně I/4 výjezd směr na Strakonice za 5760,- Kč + DPH měsíčně , včetně nákladu na jeho zhotovení, které podléhá schválení Albatros Media a.s., bude na něm titulní stránka  Hornických pohádek /1.hrubá verze, která bude ještě upravována je v příloze/, uvedeni   autor a ilustrátor,   nakladatelství Albatros Media a.s., redakce Edika  a napsáno:Věnováno k výročí 800 let města Příbram a realizováno s přispěním Středočeského kraje nejlépe na dobu od 1.3.2016 do 30.6.2016, v případě obsazenosti bilboardu na volné 4 měsíce v r.2016., Celková uvedená cena je 29 633,- Kč /výlep plakátu, údržba reklamní plochy a fotodokumentace je součástí nájmu/. Pronájem bilboardu na Strakonické silnici zajišťuje Outdoor akzent s.r.o., Štětkova 1638/18, 140 00 Praha 4, tel.: +420 221 475 158, web:www.outdoor-akzent.cz., file:///C:/Data/Downloads/Obal_layout01%20(1).pdf","neschváleno RK","29633","28133","","94.93807579","","",""
"Sportovní aktivity","2016","FHT/PHT/026473/2016","Přeplavba kanálu La Manche","Kanál La Manche se chystám přeplavat v červenci letošního roku, a to prostřednictvím britské asociace, která přeplavby pořádá. V minulosti se mi již povedlo přeplavat Gibraltarskou úžinu a mám 15 let zkušeností s dálkovým plaváním. Projekt bude realizován převážně z mých vlastních finančních prostředků.","neschváleno RK","170000","60000","","35.29411765","","",""
"Kulturní aktivity","2016","FHT/PHT/026532/2016","Mlýn všem","Ve mlýně jsme druhý rok a stále zde něco pořádáme.Letos  v rámci blížícího se 150 výročí narození mlynáře Václava Čecha,150let příchodu šlechticů z Grojů, dále nadcházejícímu 100 výročí 1.světové války pořádáme několik akcí. Začínáme 27.5.2016 besedou ,28.5.2016 muzejní noc,25.6.2016 150výročí obou rodů, od 9.7.2016-16.7.2016 Worschopy ručních prací a pokračujeme až do 30.11.2016","neschváleno RK","250000","200000","","80","","",""
"Podpora činnosti","2016","FHT/PHT/026566/2016","Senior s Domácím Andělem","Projekt Nadačního fondu Domácí Anděl s názvem ""Senior s Domácím Andělem"" je určen pro potřeby domova seniorů ve Středočeském kraji. Zaměřujeme se na monitoraci pacientů v domácím prostředí s využitím postupů telemedicíny. Tento způsob léčby rozšiřuje možnosti komunikace mezi lékařem a pacientem, který je v domácím prostředí a umožňuje, aby ošetřující lékař měl k dispozici aktuální údaje o stavu pacienta, a to zejména u pacientů chronicky nemocných, aniž by za pacientem musel docházet, případně aniž by byla nutmá návštěva pacienta v ordinaci lékaře, či jeho hospitalizace. Nadační fond Domácí Anděl připravil projekt ""Senior s Domácím Andělem"" včetně nabídky spolupráce při zajištění finančního krytí projektu pro domov seniorů TGM v Berouně, který je příspěvkovou organizací zřízenou Středočeským krajem. V rámci tohoto projektu zajistíme vzdálenou monitoraci lékařem vybraných pacientů v prostředí tohoto domova seniorů. V případě, že pacient bude vykazovat zhoršený nebo nestabilní stav, bude o tom neprodleně informován ošetřující zdravotnický personál, či lékař. Lékař i ošetřující personál má zabezpečenývzdálený přístup do aplikace dohledového centra, kde na kartě pacientamůže sledovat jeho aktuální zdravotní stav. Přínosy tohoto projektu vidíme jak v oblasti medicínské, organizační, tak i ekonomické, jelikož se sníží počet aktuálních návštěv lékaře, hospitalizace, rehospitalizace a sníží se náklady na dojezd pacientů do specializovaných ambulancí. Finanční prostředky, které bychom pomocí dotace získali, bychom použili na financování monitorace lékařem vybraných pacientů v Domově seniorů TGM v Berouně, ve Středočeském kraji po dobu šest měsíců nepřetržitě, včetně veškerých nákladů na pronájem přístrojů.","neschváleno RK","306000","199800","","65.29411765","","",""
"Pořízení vybavení pro sociální, kulturní, sportovní a vzdělávací aktivity","2016","FHT/PHT/029927/2016","Obnova ochranných sítí dětského hřiště a sportovního areálu"," Obec má ve vlastnictví dětské hřiště a sportovní areál již deset let, postupem času vlivem povětrnostního počasí dochází k rozpadu ochranných sítí kolem jednotlivých částí hřiště, sítě jsou na hranicí životnosti a jsou nedílnou součástí areálu při jeho využívání našimi dětmi a mládeží. Ochranné sítě budou dodány včetně dopravy a montáže odbornou firmou.  Realizace projektu umožní bezpečné využití stávajícího hřiště nejmenším dětem v doprovodu rodičů i starším dětem a mládeži při různých hrách, sportovních soutěží a dalších dovednostech. Hřiště i sportovní areál je hojně využíván jednotlivými dětmi, Základní a mateřskou školou, Dětským klubíkem sdružující nejmenší věkovou skupinu dětí 2 - 6 let. Obnova areálu ochrannými sítěmi zaručí bezpečnost i atraktivitu hřiště sdružující se zde právě touto věkovou skupinou. Záměrem projektu je obnova současného hřiště novými ochrannými sítěmi. Hřiště je výhodně umístěno v centru obce mezi zástavbou rodinných domů, v blízkosti školy, obecního úřadu. V blízkém okolí by rovněž měla brzy vzniknout oblast výstavby nových rodinných domů. Pozemky určené pro realizaci - parc. čísla 1097/1, 1097/2, 1097,3, 1097/4 jsou v majetku obce. Současné využití hřiště je věkovou skupinou 4 - 18 let. ","neschváleno RK","126612","100000","","78.98145515","","",""
"Kulturní aktivity","2016","FHT/PHT/026606/2016","KOSOHORSKÝ BODLÁK 2016","Regionální festival country a folkové hudby. Jedná se již o šestý ročník setkání cca 10 kapel z regionu Středočeského kraje, který probíhá formou čtyřiceti minutových vystoupení. Festival si klade za cíl potěšit všechny příznivce těchto žánrů. Dalším důležitým smyslem festivalu je nabídnout příležitost amatérským skupinám zahrát si na plně technicky vybaveném pódiu před větším počtem diváků. Večer je pak zakončen countrybálem, kde se prezentují místní taneční skupiny a tanečníci country tanců. Za dobu svého působení již tento festival získal řadu svých příznivců. Několik let má festival i své webové stránky http://kosohorsky-bodlak.webnode.cz/. Dotace by byla použita především na kvalitnější ozvučení festivalu a vystoupení kapel.","neschváleno RK","30000","15000","","50","","",""
"Kulturní aktivity","2016","FHT/PHT/026666/2016","Jarmareční sobota v Nučicích","Jarmareční sobota v Nučicích je akce typu vesnické slavnosti, pořádaná s cílem setkání všech občanů obce, propojení jednotlivých cílových skupin (děti, mládež, dospělí, senioři, místní spolky) a zkvalitnění kulturního života v obci. Jedná se o akci venkovní, pořádanou na návsi a přilehlém okolí, s celodenním kulturním programem na přistaveném pódiu a stánkovým prodejem (pouze výrobky řemeslného charakteru a pochutiny). Na pódiu se prezentují vedle amatérských či profesionálních souborů děti z místní školy a školky, místní zájmové útvary, místní divadelní spolek a školy či spolky z blízkého okolí. Součástí jarmarku je i ranní bohoslužba v nučické kapli, výstava v prostorách obecního úřadu a otevření místního hornického muzea. Rovněž jsou i tvořivé dílničky a soutěže pro děti.","neschváleno RK","96822","75000","","77.4617339","","",""
"Sportovní aktivity","2016","FHT/PHT/027095/2016","Táhneme za jeden provaz","Připravujeme projekt, který si klade za cíl vzájemné poznání, pochopení a slučování dvou světů, a to většinové společnosti s handicapovanými. Způsob realizace je formou volnočasových aktivit na kterých se budou společně podílet handicapovaní s ostatními účastníky akce. Připravujeme den plný poznávání handicapu, kdy nás nejprve čeká společný cyklovýlet do slavné Hájenky v Kersku a po návratu zpět, do sídla organizace (Nové Jirny), bude na účastníky čekat doprovodný program. V rámci cyklovýletu si nehandicapovaní účastníci vyzkouší asistenci a poznají co obnáší být dobrovolníkem a poté v odpoledních hodinách v sídle si naopak vyzkouší být v roli handicapovaného (jízda na ručním kole, invalidním vozíčku, virtuální handbike závod, aj.). Dále pro děti připravíme soutěže o ceny, pro všechny občerstvení a k tomu nám bude hrát kapela., Společné aktivity a sdílené zážitky jsou funkčním systémem nejen při sociální rehabilitaci handicapovaných, ale i nástrojem pro většinovou společnost k poznání a pochopení handicapu.","neschváleno RK","70000","50000","","71.42857143","","",""
"Vzdělávání","2016","FHT/PHT/027304/2016","Vzdělávání 3. věku - příležitost pro společnost","Akce má dvě části- představení konference v  Senátu PČR, které se koná 2.2.2016. V druhé fázi proběhne konference v Mladé Boleslavi, kde se sejdou lidé z celé České republiky, kteří se systematicky zabývají vzděláváním seniorů, a to jak na akademické půdě vysokých škol a ve vzdělávacích institucích, tak i v prostředí knihoven, muzeí, škol, sociálních ústavů, agentur atd. Cílem je výměna a shrnutí zkušeností z oblasti vzdělávání seniorů a především zdůraznění jeho významu nejen pro seniory samotné, jejich rodiny, společnost, ale i pro možnost jejich uplatnění na pracovním trhu., Přednášející patří k uznávaným autoritám v oblasti vzdělávání seniorů v rámci celé České republiky. V programu je také zahrnuta prezentace zahraničních odborníků ze Slovenska, Polska a Švédska.","neschváleno RK","120000","50000","","41.66666667","","",""
"Pořízení vybavení pro sociální, kulturní, sportovní a vzdělávací aktivity","2016","FHT/PHT/027319/2016","Nákup nové sirény pro Město Kralupy nad Vltavou","Město Kralupy nad Vltavou v současné době vlastní 6 elektronických sirén. Pět z nich je však zastaralých a často poruchových. V příloze žádosti přikládáme Stav sirén ve městě zpracovaný servisní firmou. V případě získání dotace z Fondu hejtmana Středočeského kraje, město Kralupy nad Vltavou nakoupí novou sirénu, díky které se vymění stávající siréna na objektu HZS Středočeského kraje.","neschváleno RK","251327","200000","","79.57760209","","",""
"Vzdělávání","2016","FHT/PHT/030539/2016","Štědrovečerní zvyky","vzdělávací akce poslední adventní neděli o tom jaké zvyky dodržovali naši předkové, zpívání koled za doprovodu malého orchestru a čtením Davida Vejražky","neschváleno RK","20000","15000","","75","","",""
"Rekonstrukce v souvislosti se sociální, kulturní, sportovní a vzdělávací činností","2016","FHT/PHT/027532/2016","REKONSTRUKCE PODLAH v CHRÁNĚNÉM BYDLENÍ SLAPY","POPIS VÝCHOZÍHO STAVU, CÍLE, proč projekt realizovat:, , Chráněné bydlení Fara funguje v obci Slapy od roku 2001 - bylo vybudováno díky výtěžku známé benefiční sbírky Akce cihla rekostrukcí budovy staré církevní fary. Tuto sociální službu využívá 12 klientů s mentálním postižením. Po 15 letech denního provozu se jako provozovatel sociální služby potýkáme s nutností řady dílčích rekonstrukcí a oprav, na které jen těžko hledáme prostředky z veřejných dotačních zdrojů a titulů. Jednou z nejakutnějších potřeb v tomto směru je potřeba výměny podlahových krytin ve společenské místnosti a kuchyni spojené s jídelnou (celkem 80m2 plochy). Původní repasované parkety jsou v současnosti naprosto nevyhovující z funkčního hlediska (vykazují rozklížení, praskliny, vypadávají apod.), zdravotního hlediska (při častém vytírání se pod ně dostává a zůstává pod nimi vlhkost a plísně) i z hlediska bezpečnostního (řada klientů má snížené motorické schopnosti a o nerovnosti zakopává). To vše přivádí žadatele k rozhodnutí realizovat kompletní rekonstrukci podlahových krytin ve zmíněných místnostech a uvést je do funkčního, kvalitou dlouhodobě bezúdržbového a bezpečnostně nezávadného stavu výměnou za cihelnou dlažbu a zčásti též protiskluzovou dlažbu (v okolí kuchyňského koutu, kde klienti pravidelně pomáhají s vařením.)        , , , Cílem projektu je: , , 1/ Umožnit klientům svobodně, aktivně, bez rizika a omezení využívat prostory chráněného bydlení, které je jim domovem., 2/ Zlepšit hygienické a bezpečnostní podmínky v chráněném bydlení. , , , ŽADATEL(výsledky v oblasti činnosti), CÍLOVÁ SKUPINA:, , Portus Praha, z.ú. má za sebou 15 let praxe v oboru poskytování sociálních služeb. Je provozovatelem dvou budov chráněného bydlení v obci Slapy (obě vystavěl z příjmů z vlastní činnosti a evropských dotací) celkem pro 19 klientů s mentálním postižením a provozovatelem sociálně terapeutické dílny (vše v obci Slapy). Od roku 2014 provozuje též sociální podnik na výrobu nakládaných pochutin v obci Davle (www.dobrotyspribehem.cz), kde našlo pracovní uplatnění na HPP 5 lidí s handicapem (vystavěno z příjmů z benefiční činnosti a prodeje výrobků). Portus Praha, z.ú. (www.portus.cz) je garantem patřičných zkušeností v práci s cílovou skupinou. , , Mimo dalších aktivit je i zakladatelem a koordinátorem celostátního benefičního projektu na podporu lidí s mentálním postižením Akce cihla, fungujícího již 16 let v 15 městech ČR - www.akcecihla.cz. , , , NA CO BUDOU POUŽITY FINANČNÍ PROSTŘEDKY:, , Grantový příspěvek bychom rádi využili na: , , 1/ odstranění a sanaci původních parketových podlah, 2/ přípravu podkladu a pokládku nové cihelné a protiskluzové dlažby   , , Předmětem žádosti je 85 000 Kč. , , TERMÍN REALIZACE:: , , červenec - srpen 2016 (v době dovolených klientů)  , , , OČEKÁVANÁ ZMĚNA PO REALIZACI:, , Zdravotně, bezpečnostně a funkčně nezávadné podlahy bez jakýchkoli následných investic, které budou sloužit klientům chráněného bydlení v denním životě, při odpočinku i nácviku socializačních aktivit - vaření, úklid společných prostor apod., , PROPAGACE STŘEDOČESKÉHO FONDU HEJTMANA ŽADATELEM:, , Žadatel může svoji činnost zaštítit profesionálním PR. Jsme připraveni připravit konkrétní nabídku propagace. Ta se může uskutečnit jak v rámci projektu (logo na budově chráněného bydlení, www apod.), tak v rámci celostátního PR kampaně projektu Akce cihla (TV spot, radiové stanice, plakáty v ofic. výlepu a RailReklam, cíleně distribuované letáky, atd... a také v rámci následujícího ročníku festivalu CIHLAFEST, který každoročně probíhá v zahradě chráněného bydlení (2 x billboard, plakáty atd.) a je plně otevřen veřejnosti, stejně jako řada obdobných akcí, které v zahradě pořádáme.   , ","neschváleno RK","96745","85000","","87.85983772","","",""
"Podpora činnosti","2016","FHT/PHT/030527/2016","Propagace SDH, okresu a kraje v zahraničí","Účast na mezinárodním setkání koněspřežných stříkaček Pyro-car v Polském Bielowu. Jedná se o výrobu propagačních předmětů, jednotného oblečení pro celé družstvo v průběhu akce, výroba letáků.","neschváleno RK","44000","40000","","90.90909091","","",""
"Vzdělávání","2016","FHT/PHT/027692/2016","1. a 2. ročník soutěže Tuta Via Vita aneb bezpečná cesta životem pro občana EU","Tuta Via Vitae je 1. ročník celostátní školní soutěže, které se hned v úvodním ročníku účastní 18.547 žáků a studentů základních a středních škol celé ČR. Cílem soutěže je vzdělávání dětí a mládeže za pomoci Policie ČR, Hasičského záchranného sboru a institucí v požární ochraně, civilní obraně, ochraně obyvatel, bezpečnostní problematice, krizových situacích, první pomoci, právech a povinnostech občanů při živelné pohromě, průmyslové havárii apod., Soutěž, nad kterou převzali záštitu mj. hejtmani krajů Jihočeského Mgr. JIří Zimola, Moravskoslezského pan Miroslav Novák, Plzeňského RSDr. Václav Šlajs, Středočeského Ing. Miloš Petera, Ústeckého pan Oldřich Bubeníček, Vysočiny MUDr. Jiří Běhounek a Hasičská vzájemná pojišťovna, probíhá vícekolově. Školní, okresní a krajská kola jsou prováděna na území kraje ve školních zařízeních (základní a střední školy) prostřednictvím webového rozhraní www.tutaviavitae.cz, které díky zkušenostem z předchozích ročníků našich soutěží Finanční gramotnost a SAPERE - vědět, jak žít,  již standardizovalo. Vzhledem k očekávanému rostoucímu přílivu nových soutěžících je postupně navyšována kapacita soutěžních serverů. Účastníci v daném kole soutěží pod dozorem pedagogů formou znalostního testu. Otázky jsou generovány soutěžním SW z jednotlivých tematických okruhů soutěže. Ze školních kol jsou sestaveny tříčlenné týmy, které od úrovně okresního kola reprezentují svou školu. Celostátní finále probíhá v Praze prezenčním způsobem, za účasti zástupců záštitu poskytujících institucí. , Harmonogram soutěže pro rok 2016:, , 4.1.2016 – 10.2.2016                okresní kola 1. ročníku soutěže, 22.2.206 – 31.3.2016                krajská kola 1. ročníku soutěže, 27.4.2016                                  celostátní finále 1. ročníku soutěže v Praze, květen – červen 2016                vyhodnocení 1. ročníku soutěže, prezentace výsledků, červenec 2016 – srpen 2016     příprava 2. ročníku soutěže, 19.9.2016 – 22.12.2016            školní kola 2. ročníku soutěže, ","neschváleno RK","1200000","200000","","16.66666667","","",""
